{
  "$schema": "https://json-schema.org/draft/2020-12/schema",
  "$id": "https://shared-mind.local/schemas/product-continuity-live-summary.v1.json",
  "title": "Shared Mind sanitized live product-continuity summary",
  "type": "object",
  "additionalProperties": false,
  "required": [
    "artifact_version",
    "scenario_id",
    "project_snapshot_digest",
    "provider",
    "model_snapshot",
    "client",
    "tokenizer",
    "prompt_template_sha256",
    "response_schema_sha256",
    "settings",
    "arms",
    "comparison",
    "redaction_attestation"
  ],
  "properties": {
    "artifact_version": {
      "const": "product-continuity-live-summary@1"
    },
    "scenario_id": {
      "type": "string",
      "pattern": "^[a-z][a-z0-9_-]{2,127}$"
    },
    "project_snapshot_digest": {
      "$ref": "#/$defs/sha256"
    },
    "provider": {
      "enum": ["OpenAI/Codex", "Anthropic/Claude"]
    },
    "model_snapshot": {
      "type": "string",
      "minLength": 8,
      "maxLength": 128,
      "pattern": ".*[0-9]{4}.*",
      "not": {
        "enum": ["latest", "default", "current", "stable"]
      }
    },
    "client": {
      "$ref": "#/$defs/component_version"
    },
    "tokenizer": {
      "$ref": "#/$defs/component_version"
    },
    "prompt_template_sha256": {
      "$ref": "#/$defs/sha256"
    },
    "response_schema_sha256": {
      "$ref": "#/$defs/sha256"
    },
    "settings": {
      "type": "object",
      "propertyNames": {
        "not": {
          "pattern": "([Aa][Cc][Cc][Oo][Uu][Nn][Tt][_-]?[Ii][Dd]|[Aa][Pp][Ii][_-]?[Kk][Ee][Yy]|[Aa][Uu][Tt][Hh][Oo][Rr][Ii][Zz][Aa][Tt][Ii][Oo][Nn]|[Cc][Oo][Oo][Kk][Ii][Ee]|[Cc][Rr][Ee][Dd][Ee][Nn][Tt][Ii][Aa][Ll]|[Pp][Aa][Ss][Ss][Ww][Oo][Rr][Dd]|[Pp][Aa][Tt][Hh]|[Pp][Rr][Oo][Mm][Pp][Tt]|[Rr][Ee][Qq][Uu][Ee][Ss][Tt][_-]?[Ii][Dd]|[Rr][Ee][Ss][Pp][Oo][Nn][Ss][Ee]|[Ss][Ee][Cc][Rr][Ee][Tt]|[Tt][Oo][Kk][Ee][Nn])"
        }
      },
      "additionalProperties": {
        "type": ["string", "number", "integer", "boolean", "null"]
      },
      "maxProperties": 32
    },
    "arms": {
      "type": "object",
      "additionalProperties": false,
      "required": ["manual_baseline", "context_only"],
      "properties": {
        "manual_baseline": {
          "$ref": "#/$defs/arm"
        },
        "context_only": {
          "$ref": "#/$defs/arm"
        }
      }
    },
    "comparison": {
      "oneOf": [
        {
          "$ref": "#/$defs/live_comparison_v1"
        },
        {
          "$ref": "#/$defs/live_comparison_v2"
        }
      ]
    },
    "redaction_attestation": {
      "type": "object",
      "additionalProperties": false,
      "required": ["reviewer", "reviewed_at", "statement"],
      "properties": {
        "reviewer": {
          "type": "string",
          "minLength": 3,
          "maxLength": 128
        },
        "reviewed_at": {
          "type": "string",
          "format": "date-time"
        },
        "statement": {
          "type": "string",
          "minLength": 80,
          "maxLength": 1000
        }
      }
    }
  },
  "$defs": {
    "sha256": {
      "type": "string",
      "pattern": "^sha256:[0-9a-f]{64}$"
    },
    "fraction": {
      "type": "number",
      "minimum": 0,
      "maximum": 1
    },
    "live_comparison_v1": {
      "$ref": "#/$defs/live_comparison",
      "properties": {
        "report_version": {
          "const": "product-continuity-live-comparison@1"
        },
        "reductions": {
          "$ref": "#/$defs/clamped_reductions"
        }
      }
    },
    "live_comparison_v2": {
      "$ref": "#/$defs/live_comparison",
      "properties": {
        "report_version": {
          "const": "product-continuity-live-comparison@2"
        },
        "reductions": {
          "$ref": "#/$defs/unclamped_reductions"
        }
      }
    },
    "live_comparison": {
      "type": "object",
      "additionalProperties": false,
      "required": [
        "report_version",
        "reductions",
        "meets_reduction_target",
        "quality_preserved",
        "schema_valid",
        "passed"
      ],
      "properties": {
        "report_version": {
          "type": "string"
        },
        "reductions": {
          "type": "object"
        },
        "meets_reduction_target": {
          "type": "boolean"
        },
        "quality_preserved": {
          "type": "boolean"
        },
        "schema_valid": {
          "type": "boolean"
        },
        "passed": {
          "type": "boolean"
        }
      }
    },
    "clamped_reductions": {
      "type": "object",
      "additionalProperties": false,
      "required": ["bytes", "tokens", "time_seconds"],
      "properties": {
        "bytes": {
          "$ref": "#/$defs/fraction"
        },
        "tokens": {
          "$ref": "#/$defs/fraction"
        },
        "time_seconds": {
          "$ref": "#/$defs/fraction"
        }
      }
    },
    "unclamped_reductions": {
      "type": "object",
      "additionalProperties": false,
      "required": ["bytes", "tokens", "time_seconds"],
      "properties": {
        "bytes": {
          "$ref": "#/$defs/unclamped_reduction"
        },
        "tokens": {
          "$ref": "#/$defs/unclamped_reduction"
        },
        "time_seconds": {
          "$ref": "#/$defs/unclamped_reduction"
        }
      }
    },
    "unclamped_reduction": {
      "type": "number",
      "exclusiveMaximum": 1
    },
    "component_version": {
      "type": "object",
      "additionalProperties": false,
      "required": ["name", "version"],
      "properties": {
        "name": {
          "type": "string",
          "minLength": 1,
          "maxLength": 128
        },
        "version": {
          "type": "string",
          "minLength": 1,
          "maxLength": 128
        }
      }
    },
    "arm": {
      "type": "object",
      "additionalProperties": false,
      "required": [
        "input_bytes",
        "input_tokens",
        "elapsed_time_seconds",
        "schema_validation",
        "report"
      ],
      "properties": {
        "input_bytes": {
          "type": "integer",
          "minimum": 1
        },
        "input_tokens": {
          "type": "integer",
          "minimum": 1
        },
        "elapsed_time_seconds": {
          "type": "number",
          "exclusiveMinimum": 0
        },
        "schema_validation": {
          "const": "PASS"
        },
        "report": {
          "$ref": "#/$defs/report"
        }
      }
    },
    "report": {
      "type": "object",
      "additionalProperties": false,
      "required": [
        "report_version",
        "scenario_id",
        "score",
        "maximum_score",
        "passed",
        "fact_accuracy",
        "open_conflict_member_recall",
        "dimension_scores",
        "penalty_codes",
        "metric_comparison"
      ],
      "properties": {
        "report_version": {
          "const": "product-continuity-report@1"
        },
        "scenario_id": {
          "type": "string",
          "pattern": "^[a-z][a-z0-9._-]{2,127}$"
        },
        "score": {
          "type": "integer",
          "minimum": 0,
          "maximum": 100
        },
        "maximum_score": {
          "const": 100
        },
        "passed": {
          "type": "boolean"
        },
        "fact_accuracy": {
          "$ref": "#/$defs/fraction"
        },
        "open_conflict_member_recall": {
          "$ref": "#/$defs/fraction"
        },
        "dimension_scores": {
          "type": "object",
          "additionalProperties": false,
          "required": [
            "project_purpose",
            "decision_and_rationale",
            "settled_claim_and_evidence_locator",
            "open_conflict_and_all_members",
            "open_question",
            "actionable_work"
          ],
          "properties": {
            "project_purpose": {
              "type": "integer",
              "minimum": 0,
              "maximum": 10
            },
            "decision_and_rationale": {
              "type": "integer",
              "minimum": 0,
              "maximum": 20
            },
            "settled_claim_and_evidence_locator": {
              "type": "integer",
              "minimum": 0,
              "maximum": 20
            },
            "open_conflict_and_all_members": {
              "type": "integer",
              "minimum": 0,
              "maximum": 25
            },
            "open_question": {
              "type": "integer",
              "minimum": 0,
              "maximum": 10
            },
            "actionable_work": {
              "type": "integer",
              "minimum": 0,
              "maximum": 15
            }
          }
        },
        "penalty_codes": {
          "type": "array",
          "uniqueItems": true,
          "items": {
            "enum": [
              "FALSE_SETTLED_CONFLICT_MEMBER",
              "HALLUCINATED_ID",
              "OMITTED_CONFLICT_MEMBER"
            ]
          }
        },
        "metric_comparison": {
          "type": "object",
          "additionalProperties": false,
          "required": [
            "reductions",
            "meets_reduction_target",
            "quality_preserved"
          ],
          "properties": {
            "reductions": {
              "type": "object",
              "additionalProperties": false,
              "required": ["bytes", "tokens", "time_seconds"],
              "properties": {
                "bytes": {
                  "$ref": "#/$defs/fraction"
                },
                "tokens": {
                  "$ref": "#/$defs/fraction"
                },
                "time_seconds": {
                  "$ref": "#/$defs/fraction"
                }
              }
            },
            "meets_reduction_target": {
              "type": "boolean"
            },
            "quality_preserved": {
              "type": "boolean"
            }
          }
        }
      }
    }
  }
}
