{
  "artifact_version": "product-continuity-live-summary@1",
  "scenario_id": "atlas-continuity-golden-v1",
  "project_snapshot_digest": "sha256:5624f8ae0f348d25edd7b4a2c9d62ca6ef89cf349caa47635e0ac5297fa535b2",
  "provider": "Anthropic/Claude",
  "model_snapshot": "claude-sonnet-4-5 service snapshot 2026-08-12",
  "client": {
    "name": "Claude Code",
    "version": "2.1.227"
  },
  "tokenizer": {
    "name": "provider-reported-input-accounting",
    "version": "2026-08-12 Claude Code 2.1.227"
  },
  "prompt_template_sha256": "sha256:32c647e276fcd244d16ddfd797d667f5a46ce2424ba3f15a0817632a058721e8",
  "response_schema_sha256": "sha256:15c4033f690c7dab255fa01420a8741eb23eab01c4c507cfaee183d39f21bea2",
  "settings": {
    "effort": "medium",
    "tools": "disabled",
    "web_search": "disabled",
    "file_search": "disabled",
    "memory": "disabled",
    "retrieval": "disabled",
    "structured_json_mode": "provider-structured-output-derived-schema",
    "schema_adapter": "removed only $schema and $id for structured JSON compatibility",
    "derived_schema_digest": "sha256:4367b90c7fd0a08d32eb97b2984e7e0574e7012965c01392538fad8c6b0ba0d1",
    "service_snapshot_date": "2026-08-12"
  },
  "arms": {
    "manual_baseline": {
      "input_bytes": 11034,
      "input_tokens": 5368,
      "elapsed_time_seconds": 13.767486833,
      "schema_validation": "PASS",
      "report": {
        "report_version": "product-continuity-report@1",
        "scenario_id": "atlas-continuity-golden-v1",
        "score": 100,
        "maximum_score": 100,
        "passed": true,
        "fact_accuracy": 1.0,
        "open_conflict_member_recall": 1.0,
        "dimension_scores": {
          "project_purpose": 10,
          "decision_and_rationale": 20,
          "settled_claim_and_evidence_locator": 20,
          "open_conflict_and_all_members": 25,
          "open_question": 10,
          "actionable_work": 15
        },
        "penalty_codes": [],
        "metric_comparison": {
          "reductions": {
            "bytes": 0.595,
            "tokens": 0.595,
            "time_seconds": 0.625
          },
          "meets_reduction_target": true,
          "quality_preserved": true
        }
      }
    },
    "context_only": {
      "input_bytes": 4456,
      "input_tokens": 3409,
      "elapsed_time_seconds": 17.0229445,
      "schema_validation": "PASS",
      "report": {
        "report_version": "product-continuity-report@1",
        "scenario_id": "atlas-continuity-golden-v1",
        "score": 100,
        "maximum_score": 100,
        "passed": true,
        "fact_accuracy": 1.0,
        "open_conflict_member_recall": 1.0,
        "dimension_scores": {
          "project_purpose": 10,
          "decision_and_rationale": 20,
          "settled_claim_and_evidence_locator": 20,
          "open_conflict_and_all_members": 25,
          "open_question": 10,
          "actionable_work": 15
        },
        "penalty_codes": [],
        "metric_comparison": {
          "reductions": {
            "bytes": 0.595,
            "tokens": 0.595,
            "time_seconds": 0.625
          },
          "meets_reduction_target": true,
          "quality_preserved": true
        }
      }
    }
  },
  "comparison": {
    "report_version": "product-continuity-live-comparison@1",
    "reductions": {
      "bytes": 0.596157331883,
      "tokens": 0.364940387481,
      "time_seconds": 0.0
    },
    "meets_reduction_target": false,
    "quality_preserved": true,
    "schema_valid": true,
    "passed": false
  },
  "redaction_attestation": {
    "reviewer": "local-owner-review",
    "reviewed_at": "2026-08-12T00:00:00Z",
    "statement": "Reviewed aggregate-only live summary evidence. Artifact retains metrics, hashes, versions, deterministic reports, comparison flags, and model/provider labels only; unredacted model input or output content is excluded."
  }
}
